{
  "manifest_id": "CP5-I0-FRESH-TEMPLATE-PACKAGE-001",
  "package_sha256": "7a2bc6d4eff788112b8fd36365798139067e9d1d5cbf53e848f72a895135a5b1",
  "part_count": 36,
  "parts": [
    {
      "part_name": "[Content_Types].xml",
      "part_class": "builder_required",
      "sha256": "af92d6f22411943a4ffeb884e5f43bb68730429ba8d2d17bc9d389b33bd99936"
    },
    {
      "part_name": "_rels/.rels",
      "part_class": "builder_required",
      "sha256": "694cc89ebda975bfb74644f943f86114504d64d5a6b2e420304f58ba494f0e11"
    },
    {
      "part_name": "docProps/app.xml",
      "part_class": "builder_required",
      "sha256": "77fbd43c41b96be9a40d41a267cd83108a274ee5860675dfb543828472d76867"
    },
    {
      "part_name": "docProps/core.xml",
      "part_class": "builder_required",
      "sha256": "b25bcc59255004fe78e28f81cba03ebf00eea5f5f95e9f98e71a3c20468d7d3b"
    },
    {
      "part_name": "docProps/thumbnail.jpeg",
      "part_class": "builder_required",
      "sha256": "116f9aa8ea038e39ef47ee99a23592ab569cf77feafecd0a30e222369e931d25"
    },
    {
      "part_name": "ppt/_rels/presentation.xml.rels",
      "part_class": "builder_required",
      "sha256": "85d7b9a4ed02373db9a96884425e044e91f0ed786ce68539c11f2276d89b4ad8"
    },
    {
      "part_name": "ppt/presProps.xml",
      "part_class": "builder_required",
      "sha256": "b42af61236cda9ea4d781f60908296da476489b2828df32fc9625d996808087b"
    },
    {
      "part_name": "ppt/presentation.xml",
      "part_class": "builder_required",
      "sha256": "10086a91c2c5d13f9b695c09b76f00ba54f7878a556abe5e7efc8ddaa7ff3c42"
    },
    {
      "part_name": "ppt/printerSettings/printerSettings1.bin",
      "part_class": "builder_required",
      "sha256": "d7768f87e07d29634782e448ece1cddd05a52b9499254222b1190bc8f6dc579e"
    },
    {
      "part_name": "ppt/slideLayouts/_rels/slideLayout1.xml.rels",
      "part_class": "reconstructed_shell",
      "sha256": "7c1f290acd6ca3ce664fe95aaf0b129bbb3cbf2b75c8d09905a2821641981027"
    },
    {
      "part_name": "ppt/slideLayouts/_rels/slideLayout10.xml.rels",
      "part_class": "reconstructed_shell",
      "sha256": "7c1f290acd6ca3ce664fe95aaf0b129bbb3cbf2b75c8d09905a2821641981027"
    },
    {
      "part_name": "ppt/slideLayouts/_rels/slideLayout11.xml.rels",
      "part_class": "reconstructed_shell",
      "sha256": "7c1f290acd6ca3ce664fe95aaf0b129bbb3cbf2b75c8d09905a2821641981027"
    },
    {
      "part_name": "ppt/slideLayouts/_rels/slideLayout2.xml.rels",
      "part_class": "reconstructed_shell",
      "sha256": "7c1f290acd6ca3ce664fe95aaf0b129bbb3cbf2b75c8d09905a2821641981027"
    },
    {
      "part_name": "ppt/slideLayouts/_rels/slideLayout3.xml.rels",
      "part_class": "reconstructed_shell",
      "sha256": "7c1f290acd6ca3ce664fe95aaf0b129bbb3cbf2b75c8d09905a2821641981027"
    },
    {
      "part_name": "ppt/slideLayouts/_rels/slideLayout4.xml.rels",
      "part_class": "reconstructed_shell",
      "sha256": "7c1f290acd6ca3ce664fe95aaf0b129bbb3cbf2b75c8d09905a2821641981027"
    },
    {
      "part_name": "ppt/slideLayouts/_rels/slideLayout5.xml.rels",
      "part_class": "reconstructed_shell",
      "sha256": "7c1f290acd6ca3ce664fe95aaf0b129bbb3cbf2b75c8d09905a2821641981027"
    },
    {
      "part_name": "ppt/slideLayouts/_rels/slideLayout6.xml.rels",
      "part_class": "reconstructed_shell",
      "sha256": "7c1f290acd6ca3ce664fe95aaf0b129bbb3cbf2b75c8d09905a2821641981027"
    },
    {
      "part_name": "ppt/slideLayouts/_rels/slideLayout7.xml.rels",
      "part_class": "reconstructed_shell",
      "sha256": "7c1f290acd6ca3ce664fe95aaf0b129bbb3cbf2b75c8d09905a2821641981027"
    },
    {
      "part_name": "ppt/slideLayouts/_rels/slideLayout8.xml.rels",
      "part_class": "reconstructed_shell",
      "sha256": "7c1f290acd6ca3ce664fe95aaf0b129bbb3cbf2b75c8d09905a2821641981027"
    },
    {
      "part_name": "ppt/slideLayouts/_rels/slideLayout9.xml.rels",
      "part_class": "reconstructed_shell",
      "sha256": "7c1f290acd6ca3ce664fe95aaf0b129bbb3cbf2b75c8d09905a2821641981027"
    },
    {
      "part_name": "ppt/slideLayouts/slideLayout1.xml",
      "part_class": "reconstructed_shell",
      "sha256": "25c93a2f186df69897585729d52fc610349e29dcf0b5b6080160df6490698709"
    },
    {
      "part_name": "ppt/slideLayouts/slideLayout10.xml",
      "part_class": "reconstructed_shell",
      "sha256": "1f8304c9d6c08ff9bd41b639d0c7e866b6515f61e6081c9ccc89ed8d0f8b4194"
    },
    {
      "part_name": "ppt/slideLayouts/slideLayout11.xml",
      "part_class": "reconstructed_shell",
      "sha256": "355ac266c2671b83b662759afb0ee0ecfb7cdd6ec936019ecef60dbc95c14dac"
    },
    {
      "part_name": "ppt/slideLayouts/slideLayout2.xml",
      "part_class": "reconstructed_shell",
      "sha256": "5f800acd9e43b9b438c987bd71cf0966b27ad02ce8df14df80708510cbd700be"
    },
    {
      "part_name": "ppt/slideLayouts/slideLayout3.xml",
      "part_class": "reconstructed_shell",
      "sha256": "e83a85b737e1447051ac7fd9bbaaba4ac1b4210cfc630cdcfcdbc191fdb141d1"
    },
    {
      "part_name": "ppt/slideLayouts/slideLayout4.xml",
      "part_class": "reconstructed_shell",
      "sha256": "1ebe316051a0caaac0e972989a7591e66d1fbb4a0764fe984c31a4ab5b6554bf"
    },
    {
      "part_name": "ppt/slideLayouts/slideLayout5.xml",
      "part_class": "reconstructed_shell",
      "sha256": "3df8e6f498622ef440f5568a2c967c97f47c74b46b47a976304c7b7c9ab54c74"
    },
    {
      "part_name": "ppt/slideLayouts/slideLayout6.xml",
      "part_class": "reconstructed_shell",
      "sha256": "18e5b26c6f7c30dabe0b294faf38b2d2ef60ae778fbba9c3fe71f6560143a402"
    },
    {
      "part_name": "ppt/slideLayouts/slideLayout7.xml",
      "part_class": "reconstructed_shell",
      "sha256": "e4d86b009a8ca6ca9ecfadc97c68b7123b60544df09a7ea42864a4f5f74ce09c"
    },
    {
      "part_name": "ppt/slideLayouts/slideLayout8.xml",
      "part_class": "reconstructed_shell",
      "sha256": "950b9d16468d58fe59a8c0aeb17a03b7d18a9f5bbeac438e38a2248462a72cbe"
    },
    {
      "part_name": "ppt/slideLayouts/slideLayout9.xml",
      "part_class": "reconstructed_shell",
      "sha256": "4e9439878755a7faea188d684939b2fb7d26b7e09086e792789f9137ca353e15"
    },
    {
      "part_name": "ppt/slideMasters/_rels/slideMaster1.xml.rels",
      "part_class": "reconstructed_shell",
      "sha256": "52e5efa51d86e5426d78ad9b143b863e71d00c269f6494e759cf0b3adc900116"
    },
    {
      "part_name": "ppt/slideMasters/slideMaster1.xml",
      "part_class": "reconstructed_shell",
      "sha256": "44cc65956f47c1cf689803dcc7a1d9225c93d3fd90754a9f85e2bdcea27565bc"
    },
    {
      "part_name": "ppt/tableStyles.xml",
      "part_class": "builder_required",
      "sha256": "0e7ac03251337ecbaf6c8ca13619db1caeda5c90c4e3210d45d6c3f5df4de103"
    },
    {
      "part_name": "ppt/theme/theme1.xml",
      "part_class": "reconstructed_shell",
      "sha256": "4c3412087e8fa20cf5642f42e69f1e733881c28611a2bdd4622654ee313d214e"
    },
    {
      "part_name": "ppt/viewProps.xml",
      "part_class": "builder_required",
      "sha256": "f2e3578e8a2a2607ca7f850d99f2cbe5f22806084c8e519bb754388ed7ebdb69"
    }
  ],
  "unclassified_part_count": 0,
  "forbidden_part_count": 0,
  "forbidden_parts": [],
  "fresh_lineage_inputs": [
    "artifacts/phase3/professor-template-resolved.json",
    "artifacts/phase3/sanitized-shell-structural-descriptors.json",
    "artifacts/phase3/visual-style-profile.json"
  ],
  "private_alias_resolution_attempts": 0,
  "private_source_open_attempts": 0,
  "private_render_attempts": 0
}
